{"canonical_profile":"schuss-canonical-json-v1","compound_interface_mappings":[],"connections":[{"connection_id":"graph-connection-000001","destination":{"facet_id":"component-port-000001","node_id":"graph-node-000002"},"source":{"facet_id":"component-port-000003","node_id":"graph-node-000001"}},{"connection_id":"graph-connection-000002","destination":{"facet_id":"component-port-000001","node_id":"graph-node-000003"},"source":{"facet_id":"component-port-000003","node_id":"graph-node-000002"}},{"connection_id":"graph-connection-000003","destination":{"facet_id":"component-port-000002","node_id":"graph-node-000003"},"source":{"facet_id":"component-port-000003","node_id":"graph-node-000002"}}],"content_hash":"sha256:4f771207da09b664685ed2ff382e213916a145026d6dc34ce88b3cee1cb0f7f3","display_name":"Clocked dual-percussion reference graph","graph_id":"schuss-graph-000003","hierarchy_edges":[],"nodes":[{"attribute_values":[],"contract_reference":{"component_contract_id":"schuss-component-contract-000004","content_hash":"sha256:987acb05ac5334d69a87af584395d3d9728a2e566d8f932d7767176324701877","revision":1},"node_id":"graph-node-000001","parameter_values":[]},{"attribute_values":[],"contract_reference":{"component_contract_id":"schuss-component-contract-000021","content_hash":"sha256:56d17b6eb7f49cea1f0ebd4059495ffa409ceda5d8360de4c301059452d5a7f9","revision":1},"node_id":"graph-node-000002","parameter_values":[]},{"attribute_values":[],"contract_reference":{"component_contract_id":"schuss-component-contract-000009","content_hash":"sha256:179c1526ed2bd6d9ad1c6fbfc9caa7abc21f479bef50cf93c8599b5817ca8718","revision":1},"node_id":"graph-node-000003","parameter_values":[]}],"parameter_bindings":[{"binding_id":"graph-binding-000001","binding_kind":"parameter-to-port","destination":{"facet_id":"component-port-000002","facet_kind":"port","node_id":"graph-node-000002"},"destination_domain":{"maximum":"1","maximum_inclusive":true,"minimum":"0","minimum_inclusive":true,"overflow_policy":"reject","status":"known","unit":"normalized"},"driver_policy":"exclusive","smoothing":{"completion":"next-control-cycle","kind":"linear","responsibility":"graph"},"source_domain":{"maximum":"1","maximum_inclusive":true,"minimum":"0","minimum_inclusive":true,"overflow_policy":"reject","status":"known","unit":"normalized"},"source_graph_parameter_id":"graph-facet-000001","transform":{"curve":"linear","points":[{"destination":"0","source":"0"},{"destination":"1","source":"1"}],"polarity":"direct"},"update_boundary":"control-cycle"}],"public_actions":[],"public_displays":[],"public_facet_exposures":[],"public_parameters":[{"default":"0.5","display_label":"Voice Mix","domain":{"maximum":"1","maximum_inclusive":true,"minimum":"0","minimum_inclusive":true,"overflow_policy":"reject","status":"known","unit":"normalized"},"facet_id":"graph-facet-000001","semantic_key":"voice-mix","update_behavior":{"stateful":true,"update_kind":"runtime"},"value_type":"exact-decimal"}],"public_port_exposures":[],"public_ports":[],"revision":1,"schema_version":"dsp-graph-v0"}
